{
 "$schema":"https://json-schema.org/draft/2020-12/schema",
 "$id":"https://local.lumilearn.invalid/schemas/question-set.schema.json",
 "title":"LumiLearn Home Question Set 1.0.0",
 "type":"object","additionalProperties":false,
 "required":["schemaVersion","setId","title","locale","grade","subject","source","curriculum","questions"],
 "properties":{
  "schemaVersion":{"const":"1.0.0"},
  "setId":{"type":"string","minLength":1,"maxLength":120},
  "title":{"type":"string","minLength":1,"maxLength":200},
  "description":{"type":"string","maxLength":2000},
  "locale":{"type":"string","minLength":2,"maxLength":20},
  "grade":{"type":"string","enum":["Pre-K","K","1","2","3","4","5","6","7","8","9","10","11","12"]},
  "subject":{"type":"string","enum":["math","reading","writing","science","social_studies"]},
  "source":{"type":"object","additionalProperties":false,"required":["type"],"properties":{"type":{"enum":["ai_generated","manual","worksheet","curriculum"]},"generator":{"type":"string","maxLength":100},"referenceUrls":{"type":"array","items":{"type":"string","format":"uri"},"maxItems":20},"documentIds":{"type":"array","items":{"type":"string"},"maxItems":20}}},
  "curriculum":{"type":"object","additionalProperties":false,"required":["framework","standardCodes","alignmentStatus"],"properties":{"framework":{"type":"string","maxLength":50},"standardCodes":{"type":"array","items":{"type":"string"},"uniqueItems":true},"alignmentStatus":{"enum":["verified","unverified","general_practice"]}}},
  "questions":{"type":"array","minItems":1,"maxItems":200,"items":{"$ref":"#/$defs/question"}}
 },
 "$defs":{
  "option":{"type":"object","additionalProperties":false,"required":["id","text"],"properties":{"id":{"type":"string","minLength":1,"maxLength":60},"text":{"type":"string","minLength":1,"maxLength":1000}}},
  "prompt":{"type":"object","additionalProperties":false,"required":["format","text","translationPolicy"],"properties":{"format":{"enum":["plain","markdown"]},"text":{"type":"string","minLength":1,"maxLength":12000},"translationPolicy":{"enum":["allowed","paragraph_only","disabled"]}}},
  "answer":{"oneOf":[
   {"type":"object","additionalProperties":false,"required":["kind","optionId"],"properties":{"kind":{"const":"option_id"},"optionId":{"type":"string"}}},
   {"type":"object","additionalProperties":false,"required":["kind","optionIds"],"properties":{"kind":{"const":"option_ids"},"optionIds":{"type":"array","minItems":1,"uniqueItems":true,"items":{"type":"string"}}}},
   {"type":"object","additionalProperties":false,"required":["kind","value","tolerance"],"properties":{"kind":{"const":"number"},"value":{"type":"number"},"tolerance":{"type":"number","minimum":0},"unit":{"type":["string","null"]}}},
   {"type":"object","additionalProperties":false,"required":["kind","accepted"],"properties":{"kind":{"const":"text"},"accepted":{"type":"array","minItems":1,"uniqueItems":true,"items":{"type":"string","minLength":1}},"normalization":{"enum":["trim_casefold","trim_only","exact"]}}},
   {"type":"object","additionalProperties":false,"required":["kind","orderedIds"],"properties":{"kind":{"const":"ordered_ids"},"orderedIds":{"type":"array","minItems":2,"uniqueItems":true,"items":{"type":"string"}}}},
   {"type":"object","additionalProperties":false,"required":["kind","value"],"properties":{"kind":{"const":"boolean"},"value":{"type":"boolean"}}},
   {"type":"object","additionalProperties":false,"required":["kind","criteria","sampleAnswer"],"properties":{"kind":{"const":"rubric"},"criteria":{"type":"array","minItems":1,"items":{"type":"object","additionalProperties":false,"required":["label","description","weight"],"properties":{"label":{"type":"string"},"description":{"type":"string"},"weight":{"type":"number","minimum":0,"maximum":1}}}},"sampleAnswer":{"type":"string","minLength":1}}}
  ]},
  "question":{"type":"object","additionalProperties":false,"required":["externalId","type","prompt","grade","subject","difficulty","tags","standardCodes","options","answer","grading","parentExplanation","assets"],
   "properties":{"externalId":{"type":"string","minLength":1,"maxLength":100},"type":{"enum":["single_choice","multiple_choice","number","short_text","ordering","true_false","long_text","handwriting"]},"prompt":{"$ref":"#/$defs/prompt"},"grade":{"type":"string"},"subject":{"type":"string"},"difficulty":{"enum":["review","grade_level","advanced"]},"tags":{"type":"array","items":{"type":"string"},"uniqueItems":true},"standardCodes":{"type":"array","items":{"type":"string"},"uniqueItems":true},"options":{"type":"array","maxItems":8,"items":{"$ref":"#/$defs/option"}},"answer":{"$ref":"#/$defs/answer"},"grading":{"type":"object","additionalProperties":false,"required":["mode","maxAttempts"],"properties":{"mode":{"enum":["deterministic","ai","parent_review"]},"caseSensitive":{"type":"boolean"},"maxAttempts":{"type":"integer","minimum":1,"maximum":100}}},"parentExplanation":{"type":"object","additionalProperties":false,"required":["reasoning","steps"],"properties":{"reasoning":{"type":"string"},"steps":{"type":"array","items":{"type":"string"}}}},"studentTranslation":{"type":"object","additionalProperties":false,"properties":{"vi":{"type":"string"}}},"assets":{"type":"array","items":{"type":"object","required":["localRef"],"properties":{"localRef":{"type":"string"},"alt":{"type":"string"}},"additionalProperties":false}},"metadata":{"type":"object"}},
   "allOf":[
    {"if":{"properties":{"type":{"const":"single_choice"}}},"then":{"properties":{"answer":{"properties":{"kind":{"const":"option_id"}}},"options":{"minItems":2}}}},
    {"if":{"properties":{"type":{"const":"multiple_choice"}}},"then":{"properties":{"answer":{"properties":{"kind":{"const":"option_ids"}}},"options":{"minItems":2}}}},
    {"if":{"properties":{"type":{"const":"number"}}},"then":{"properties":{"answer":{"properties":{"kind":{"const":"number"}}}}}},
    {"if":{"properties":{"type":{"const":"short_text"}}},"then":{"properties":{"answer":{"properties":{"kind":{"const":"text"}}}}}},
    {"if":{"properties":{"type":{"const":"ordering"}}},"then":{"properties":{"answer":{"properties":{"kind":{"const":"ordered_ids"}}},"options":{"minItems":2}}}},
    {"if":{"properties":{"type":{"const":"true_false"}}},"then":{"properties":{"answer":{"properties":{"kind":{"const":"boolean"}}}}}},
    {"if":{"properties":{"type":{"const":"long_text"}}},"then":{"properties":{"answer":{"properties":{"kind":{"const":"rubric"}}}}}}
   ]
  }
 }
}
